{
  "case_id": "macro_rate_hike_001",
  "category": "macro",
  "risk_level": "A",
  "description": "V2.1 Standard: Fed rate hike. Bearish macro signal.",
  "input": {
    "event_id": "EVT-FED-20260415-008",
    "event_type": "macro",
    "event_time": "2026-04-15T14:05:00Z",
    "headline": "Fed raises rates by 25 basis points",
    "raw_text": "The Federal Reserve raised benchmark rates to combat persistent inflation pressures.",
    "source_type": "official",
    "source_url": "https://www.federalreserve.gov/newsevents/pressreleases.htm",
    "timestamp": "2026-04-15T14:05:00Z",
    "a0_event_strength": 80.0,
    "expectation_gap": 0.0,
    "event_state": "Initial",
    "confidence": 1.0,
    "transmission_candidates": [
      {
        "factor": "Tightening Fundamental",
        "logic": "Higher borrowing costs, valuation compression"
      }
    ],
    "risk_flags": [
      "liquidity_drain"
    ],
    "evidence_spans": [
      "Fed raises rates by 25 basis points",
      "combat persistent inflation"
    ],
    "evidence_grade": "A"
  },
  "scenario": {
    "transmission_paths": [
      {
        "path_id": "hike_fund",
        "path_name": "tightening_fundamental",
        "path_type": "fundamental",
        "confidence": 85.0
      }
    ],
    "sectors": [
      {
        "name": "科技",
        "direction": "SHORT",
        "impact_score": 0.85,
        "confidence": 0.9
      }
    ],
    "stock_candidates": [
      {
        "symbol": "NVDA",
        "sector": "科技",
        "direction": "SHORT",
        "event_beta": 1.2,
        "realtime_price": 970.0
      }
    ],
    "asset_validation": {
      "score": 82
    }
  },
  "expect": {
    "required_fields": [
      "source_rank",
      "dominant_path",
      "opportunities",
      "gate_reason_code"
    ],
    "allowed_signals": [
      "SHORT",
      "WATCH"
    ],
    "max_final_action": "EXECUTE",
    "allow_empty_opportunities": false,
    "must_have_gate_reason_code": true,
    "expected_path_types_any_of": [
      "fundamental",
      "asset_pricing"
    ],
    "forbidden_signals": []
  }
}