{
  "case_id": "earnings_beat_nvda_001",
  "category": "earnings",
  "risk_level": "A",
  "description": "Mega-cap tech earnings beat should not produce short-first signal.",
  "input": {
    "headline": "NVIDIA beats earnings expectations and raises guidance",
    "raw_text": "The company reported stronger revenue growth and improved guidance.",
    "source_type": "wire",
    "source_url": "https://www.cnbc.com/markets/",
    "timestamp": "2026-04-15T20:10:00Z"
  },
  "scenario": {
    "transmission_paths": [
      {"path_id": "beat_fund", "path_name": "earnings_fundamental", "path_type": "fundamental", "confidence": 85.0},
      {"path_id": "beat_asset", "path_name": "valuation_repricing", "path_type": "asset_pricing", "confidence": 78.0},
      {"path_id": "beat_narr", "path_name": "momentum_narrative", "path_type": "narrative", "confidence": 63.0}
    ],
    "sectors": [
      {"name": "科技", "direction": "LONG", "impact_score": 0.88, "confidence": 0.9}
    ],
    "stock_candidates": [
      {"symbol": "NVDA", "sector": "科技", "direction": "LONG", "event_beta": 1.3, "realtime_price": 1020.0}
    ],
    "asset_validation": {"score": 89}
  },
  "expect": {
    "required_fields": ["source_rank", "dominant_path", "mixed_regime", "opportunities", "state_machine_step", "gate_reason_code"],
    "allowed_signals": ["LONG", "WATCH"],
    "forbidden_signals": ["SHORT"],
    "expected_path_types_any_of": ["fundamental", "asset_pricing"],
    "max_final_action": "EXECUTE",
    "allow_empty_opportunities": false,
    "must_have_gate_reason_code": true
  }
}
